{
  "schema_version": 1,
  "showdown_commit": "7244fe8e28fa8bc4d0809ae30d183c608b62bb2b",
  "format_id": "gen9championsvgc2026regmc",
  "mod": "champions",
  "engine_data_hash": "6f3d19f02b0e8464d813f4bbdced99c6f88140099818f5f225776ac43fa5590e",
  "classes": {
    "status": [
      "acidarmor",
      "acupressure",
      "afteryou",
      "agility",
      "allyswitch",
      "amnesia",
      "aquaring",
      "aromaticmist",
      "attract",
      "auroraveil",
      "babydolleyes",
      "banefulbunker",
      "batonpass",
      "bellydrum",
      "block",
      "bulkup",
      "calmmind",
      "charge",
      "charm",
      "chillyreception",
      "clangoroussoul",
      "coaching",
      "coil",
      "confuseray",
      "copycat",
      "corrosivegas",
      "cosmicpower",
      "cottonguard",
      "cottonspore",
      "courtchange",
      "curse",
      "decorate",
      "defog",
      "destinybond",
      "detect",
      "disable",
      "doubleteam",
      "dragoncheer",
      "dragondance",
      "eerieimpulse",
      "electricterrain",
      "electrify",
      "encore",
      "endure",
      "entrainment",
      "fairylock",
      "faketears",
      "featherdance",
      "flatter",
      "focusenergy",
      "followme",
      "forestscurse",
      "gastroacid",
      "glare",
      "grassyterrain",
      "gravity",
      "growth",
      "guardsplit",
      "guardswap",
      "haze",
      "healbell",
      "healingwish",
      "healpulse",
      "helpinghand",
      "howl",
      "hypnosis",
      "imprison",
      "ingrain",
      "instruct",
      "irondefense",
      "kingsshield",
      "leechseed",
      "lifedew",
      "lightscreen",
      "lockon",
      "magicpowder",
      "magicroom",
      "magneticflux",
      "magnetrise",
      "meanlook",
      "memento",
      "metalsound",
      "milkdrink",
      "minimize",
      "mistyterrain",
      "moonlight",
      "morningsun",
      "nastyplot",
      "nobleroar",
      "noretreat",
      "octolock",
      "painsplit",
      "partingshot",
      "perishsong",
      "poisonpowder",
      "powershift",
      "powersplit",
      "powerswap",
      "powertrick",
      "protect",
      "psychicterrain",
      "psychup",
      "quash",
      "quickguard",
      "quiverdance",
      "ragepowder",
      "raindance",
      "recover",
      "recycle",
      "reflect",
      "reflecttype",
      "rest",
      "revivalblessing",
      "roar",
      "rockpolish",
      "roleplay",
      "roost",
      "safeguard",
      "sandstorm",
      "scaryface",
      "screech",
      "shedtail",
      "shellsmash",
      "shelter",
      "shiftgear",
      "simplebeam",
      "sing",
      "skillswap",
      "slackoff",
      "sleeppowder",
      "sleeptalk",
      "snowscape",
      "soak",
      "softboiled",
      "speedswap",
      "spicyextract",
      "spikes",
      "spikyshield",
      "spite",
      "spore",
      "stealthrock",
      "stickyweb",
      "stockpile",
      "strengthsap",
      "stringshot",
      "stuffcheeks",
      "stunspore",
      "substitute",
      "sunnyday",
      "swagger",
      "swallow",
      "sweetkiss",
      "sweetscent",
      "switcheroo",
      "swordsdance",
      "synthesis",
      "tailwind",
      "taunt",
      "tearfullook",
      "teatime",
      "teeterdance",
      "thunderwave",
      "tickle",
      "tidyup",
      "topsyturvy",
      "torment",
      "toxic",
      "toxicspikes",
      "toxicthread",
      "transform",
      "trick",
      "trickortreat",
      "trickroom",
      "whirlwind",
      "wideguard",
      "willowisp",
      "wish",
      "wonderroom",
      "worryseed",
      "yawn"
    ],
    "lowers_target_stat": [
      "acidspray",
      "appleacid",
      "babydolleyes",
      "bittermalice",
      "breakingswipe",
      "bulldoze",
      "charm",
      "chillingwater",
      "cottonspore",
      "drumbeating",
      "eerieimpulse",
      "electroweb",
      "faketears",
      "featherdance",
      "firelash",
      "gravapple",
      "icywind",
      "lowsweep",
      "luminacrash",
      "lunge",
      "memento",
      "metalsound",
      "mudshot",
      "mudslap",
      "mysticalfire",
      "nobleroar",
      "pounce",
      "rocktomb",
      "scaryface",
      "screech",
      "skittersmack",
      "snarl",
      "spicyextract",
      "spiritbreak",
      "stringshot",
      "strugglebug",
      "sweetscent",
      "tearfullook",
      "tickle",
      "toxicthread",
      "tropkick"
    ],
    "raises_own_stat": [
      "acidarmor",
      "agility",
      "amnesia",
      "aquastep",
      "aromaticmist",
      "aurawheel",
      "bulkup",
      "calmmind",
      "charge",
      "clangoroussoul",
      "coaching",
      "coil",
      "cosmicpower",
      "cottonguard",
      "doubleteam",
      "dragondance",
      "flamecharge",
      "growth",
      "howl",
      "irondefense",
      "minimize",
      "nastyplot",
      "noretreat",
      "psyshieldbash",
      "quiverdance",
      "rapidspin",
      "rockpolish",
      "scaleshot",
      "shellsmash",
      "shelter",
      "shiftgear",
      "swordsdance",
      "torchsong",
      "trailblaze"
    ],
    "side_condition": [
      "auroraveil",
      "lightscreen",
      "quickguard",
      "reflect",
      "safeguard",
      "spikes",
      "stealthrock",
      "stickyweb",
      "tailwind",
      "toxicspikes",
      "wideguard"
    ],
    "field_condition": [
      "chillyreception",
      "electricterrain",
      "fairylock",
      "grassyterrain",
      "gravity",
      "magicroom",
      "mistyterrain",
      "psychicterrain",
      "raindance",
      "sandstorm",
      "snowscape",
      "sunnyday",
      "trickroom",
      "wonderroom"
    ],
    "protection": [
      "banefulbunker",
      "detect",
      "endure",
      "kingsshield",
      "protect",
      "spikyshield"
    ]
  }
}
